2.3529411764705883,CN205532601U,"The utility model provides a be used for freezing prefabricated piecing devices of well wall of a well, connect the headrest layer including the wedge, the wedge connects the headrest layer to inlay among the inside and outside wall of reinforced concrete, reinforced concrete inner wall and outer wall adopt prefabricatedly, reinforced concrete inner wall and outer wall reservation slip casting pipe, the wedge connects headrest layer interface department installation waterstop, the waterstop is used from waterproof nail fixing. This device adopts the contractible joint of regarding as the bed course material with polymer based composite, has good deformation characteristic, can attenuate effectively to connect cross -section stress. At the atress in -process, the bed course corner variation tendency of different thickness is the same basically, before bed course material deflection is lost completely, freezes the prefabricated arc board wall of a well deformation of well and mainly receives the bed course material to warp control."
0.3831417624521073,CN205534613U,"The utility model provides a warm up and be responsible for riser fixing device belongs to heating equipment technical field, and its structure includes and warms up inlet tube, pre -buried wet return and the water collecting and dividing device of warming up pre -buriedly, the head -end that warms up the inlet tube is provided with the pre -buried elbow of intaking pre -buriedly, the head -end of the pre -buried elbow of intaking extends the diaphragm orifice of intaking of the pre -buried fixed plate of cross -under up, the riser of intaking is connected to the head -end of the pre -buried elbow of intaking, the face end angle department of pre -buried fixed plate has seted up the nail hole, is provided with the mortar staple on the nail hole, the riser of intaking upwards extends wears out mortar bed and ground floor, and the elbow of intaking is connected on the top of the riser of intaking, and the corner joint of intaking is intake and is violently managed, intake violently manage, the return water violently manages and passes upright wall and feed through water collecting and dividing device. This warm up and be responsible for riser fixing device warms up the fixed cost of PPR pipe with reducing to for making things convenient for confession, wet return to be connected with water collecting and dividing device's on next step, and wireless?connection is pleasing to the eye."
0.47393364928909953,CN205514791U,"The utility model provides a central type oversleeve reamer, including stop device, the oversleeve reamer, tibial plateau tries the mould and has the head nail, tibial plateau examination mould is through there being the head nail fixing on the shin bone surface of bone, the stop device one end of cylinder is installed at tibial plateau examination mould another side, the spacing flank inslot of two the spacing flank of arch cooperation embedding tibial plateau examination moulds on the stop device excircle both sides, embolia the disc -shaped locking plate on the last perpendicular screw thread vertical scroll of stop device, the locking groove on the tibial plateau examination mould is inserted in protruding cooperation on the locking plate, lock by the nut, cylinder oversleeve reamer cutting edge end inserts the stop device hole, and spacing ring and solid fixed ring cooperation that the handle of a knife was served are carried on spacing fixedly, electric drill articulate electric drill. The utility model discloses when guaranteeing that the oversleeve reamer remains neutral position throughout, can cut the bone processing by effective accurate bone bed to the shin bone near -end to can remain more bone volumes."
0.44642857142857145,CN205502420U,"The utility model relates to a double -deck air interlayer's heat preservation roofing, from bottom to top in proper order including roof boarding, waterproof layer, to hold nail layer, counter battens, heat insulating board, tile batten and piece made of baked clay, tile batten, counter battens are a plurality of respectively, tile batten, the equal interval default distance of counter battens set up, just the counter battens sets up with tile batten mutually perpendicular, the upper and lower both sides of heat insulating board are respectively with a plurality of tile batten, counter battens are connected, thereby the upper and lower both sides of heat insulating board are formed with upper air interlayer, the air interlayer of lower floor. The utility model discloses a form double -deck air interlayer between piece tile, tile batten, heat insulating board, counter battens and protective layer, because air thermal resistance value is great, reduced the insulation layer thickness, have the thermal -radiating effect of good separation because of the air bed simultaneously, can better reduce heat -conduction and heat convection to reach the heat preservation effect of high efficiency, economy, and have energy -conservation, economy, safety, efficient characteristics."
0.47393364928909953,CN205496070U,"The utility model relates to an afforestation machinery, concretely relates to multi -functional integral type afforestation instrument, including feeding board, export slide, motor and frame, the feeding board links to each other with the frame with the export slide in proper order, be equipped with the band pulley in the frame, still include cylinder and shale shaker, be equipped with hold -down mechanism on the band pulley, the shale shaker is equipped with two blocks of steel sheets, the feeding board is connected to the upper strata steel sheet, the funnel is connected to lower floor's steel sheet, the motor is connected with the knife section, the blade downside is fixed with the sword bed, be equipped with nail tooth spiral on the cylinder, the cylinder is connected with the tooth chain sprocket, the tooth chain chain takes turns to and is equipped with tooth chain, the utility model relates to a simply, the treatment effeciency is high, and is with low costs, environmental protection and energy saving, and functional powerful, low cost can extensively use widely, can effectively solve the problem among the technical background."
0.6688963210702341,CN105889636A,"The invention discloses an efficient heat insulation guide pipe bracket which comprises an upper hoop, heat insulation tile blocks, high-temperature-resistant soft heat preservation materials, bolt fasteners, a lower hoop, a base and a foundation bed. The upper hoop and the lower hoop are each of a semi-ring structure, and the two sides of the upper hoop and the two sides of the lower hoop extend to form fixing ends. The heat insulation tile blocks are poured on both the inner wall of the upper hoop and the inner wall of the lower hoop. The high-temperature-resistant soft heat preservation materials adhere to the inner walls of the heat insulation tile blocks. The upper hoop and the lower hoop are connected through the bolt fasteners arranged at the fixing ends. The lower hoop is connected to the base in a welded mode. The bottom of the base is provided with an upper sliding plate which is arranged on a lower sliding plate above the foundation bed. Accordingly, the efficient heat insulation guide pipe bracket is formed. Anchor nails and pull rods are additionally arranged between the upper hoop and the heat insulation tile blocks and additionally arranged between the lower hoop and the heat insulation tile blocks. According to the efficient heat insulation guide pipe bracket, by the adoption of the structural form that the anchor nails and the pull rods are additionally arranged between the upper hoop and the heat insulation tile blocks and additionally arranged between the lower hoop and the heat insulation tile blocks, the load bearing capacity of the pipe bracket is ensured, the loading capacity is high, and the heat transfer insulating effect is good."
0.4608294930875576,CN205466610U,"The utility model relates to a wooden block dish combination nail bed, it includes the bottom plate, set up in left side foot mound positioning area, middle part foot mound positioning area, right side foot mound positioning area, left side plate support district and right side plate support district on the bottom plate, left side plate support position in left side foot mound positioning area with between the foot mound positioning area of middle part, right side plate support position in right side foot mound positioning area with between the foot mound positioning area of middle part, left side foot mound positioning area middle part foot mound positioning area with right side foot mound positioning area internal fixation is provided with a plurality of foot mound setting elements that wooden block pan jiaodun moved that are used for limiting, left side plate support district with be provided with a plurality of plate support spares that are used for supporting the long brace between two foot mounds on the wooden block dish in the right side plate support district. The utility model discloses workshop production efficiency has been improved greatly, because the accurate instability who has reduced the product quality that artifical processing brought in location."
2.314814814814815,CN205490398U,"The utility model relates to an it embeds bed hedgehopping positioner for fuse to be applicable to collection flow box, including bed hedgehopping stand body, its characteristics are: bottom at bed hedgehopping stand body is provided with the locating hole, and the top of bed hedgehopping stand body is provided with the locating convex block, and it has locating component to distribute on the inner wall of locating hole. From this, rely on the existence of locating hole, can realize bed hedgehopping stand body and converge in the flow box predetermined location nail or location guide strip links to each other, remove bonding or the fashioned loaded down with trivial details step of integral type from. Simultaneously, possess the locating convex block, can install the location to the fuse of various classifications, guarantee not become flexible between the service time, do not drop. And, possess the insulating blanket, can not constitute conductive medium, guarantee the stability of other components and parts functions. From this, can distribute according to the needs of follow -up fuse in -service use and arrange, it is extravagant not constitute the material, and the overall arrangement is more reasonable."
0.36363636363636365,CN205472186U,"The utility model discloses a sedan -chair door locking device for asynchronous door sword, including hitting a restoring element that base on the bottom plate of bow, bottom plate, setting, latch hook, setting pushing away on the latch hook supported, linked to each other with the base, pushing away hitting the nail and possessing the notched support to the base, the latch hook rotates to be connected in the base and has the hook portion of stretching out the bottom plate, the bottom plate is fixed on the door machine of elevator, the both ends of support respectively with hit nail and hold -in range connecting plate fixed connection, it installs on the layer door of elevator on the bank top surface to hit the bow, when car operation to layer door position and elevator when opening the door, the hold -in range connecting plate drives and hits the nail to the direction motion of keeping away from the base, and the base drives the latch hook and is close to the support and removes with pushing away to support under restoring element's effect, pushes away to support the piece and push away and support that hit the latch hook rotation of bow messenger and recess, realization unblock leave in hook portion. Adopt the utility model discloses a sedan -chair door locking device for asynchronous door sword prevents that the people from for pushing the sedan -chair door at the car of non - flat bed aside, having improved the quick -witted security of door."
0.4878048780487805,CN205431451U,"The utility model relates to an insulation can technical field specifically discloses a detachable piglet insulation can. The utility model discloses a detachable piglet insulation can is by the lower plate, curb plate, upper cover hoarding close and form all around, the lower plate adopts the deal board concatenation, and lower boat nail has the lath for concatenation and built on stilts lower plate, lower plate size just fall into in the curb plate the inside, the curb plate adopts the waterproof board preparation all around, the curb plate is installed by the last line of down tipping in through the bed hinge is reverse all around, order a side of establishing on the inside top of curb plate all around for support the upper cover plate, two faces in the above -mentioned curb plate are all around set for to first curb plate and second curb plate, into pig door has been seted up on the first curb plate, a viewing aperture has been seted up on the second curb plate. Simple manufacture, convenient operation, construction cost is low, more is favorable to the swinery to grow."
0.4854368932038835,CN205421157U,"The utility model discloses a reinforced earth quaywall structure based on soft base of mud flat, including set up plastics drain bar in the weak soil, lay in the drainage bed course on weak soil surface, bagged sand by the cofferdam, be used for protection and earth -retaining prefabricated shingle nail, in advance embedded in bagged sand strained geotechnological cloth by the cap stone, bagged sand that add pile foundation, the panel top of filler material between by the cofferdam of muscle area, shingle nail and bagged sand, panel below in cofferdam by cofferdam rear counter. Above -mentioned structure is through implementing step by step, makes deformation basic completion before the construction shingle nail in soft soil foundation and cofferdam, reduces and subsides behind the worker and uniform settlement not. The construction platform of shingle nail and pile foundation can be regarded as again in the bagged sand cofferdam, becomes the intertidal zone construction and into land construction, has improved execution conditions. But the structure can adapt to the simple stage construction of bearing capacity and deformation, construction process, the saving?investment of soft soil foundation."
0.45662100456621,CN205289613U,"The utility model discloses a height combination bed die that shears with interchangeable function, including preceding mold core (1), back mold core (2), overcoat (4), its characterized in that: preceding mold core (1) and back mold core (2) dress is inside at overcoat (4), and preceding mold core (1) smooth closing is installed in overcoat (4) front portion, and back mold core (2) smooth closing is installed at overcoat (4) rear portion, and preceding mold core (1) and back mold core (2) are through the end face contaction location, and mold core gland (3) pressfitting is on overcoat (4) after through for back mold core (2), and preceding mold core (1) inside is provided with die cavity hole B (6), and back mold core (2) inside is provided with die cavity hole A (5). The utility model discloses simple structure, high -efficient practicality, convenient operation, economically feasible, suitable height the using widely that the hexagonal head nail body (7) processed of shearing."
1.7467248908296944,CN205294513U,"The utility model provides a novel multi -functional earth connection receive and releases frame includes the handle, the handle cover, and the axle bed, the pivot, the handle, the ground nail, the wheel receive and releases the dish, receive and releases controlling means automatically, handle both ends fixed connection on the axle bed, handle cover set up in the handle outside, the pivot pass through the bearing and connect position between the axle bed, the handle setting in the outside of axle bed, the ground nail setting at the lower extreme of intermediate position that receive and releases the dish, the wheel install receiving and releasing the dish the below, the automation receive and release controlling means and set up in the handle left side. The utility model discloses an automatically receive and release controlling means's setting, improved the degree of automation who receive and releases the frame, alleviateed staff's working strength, the setting of wheel simultaneously is favorable to making receiving and releasing towards all directions and removes, has reduced the work load that the frame was receive and release in staff's transport, and the setting of transmission shaft has durable, unsuitable rusty advantage, is favorable to transmitting power for the pivot."
0.4878048780487805,CN205390434U,"The utility model provides a protection dactylotheca, the dactylotheca body has, the dactylotheca body is arranged according to the hand -type five tubulose dactylotheca of making with hard material and is formed by connecting, every root canal form dactylotheca length is greater than 30mm, wherein the dactylotheca between four fingers uses the width to connect as 10mm's silica gel spare, silica gel spare shape is circular or square and swells to pointing the below, be connected with the palm layer board bottom the dactylotheca body, palm upper surface of support plate system has a plurality of non -slip raised, palm layer board left and right sides system has the through -hole, the through -hole is equipped with the frenulum, every independent tubulose dactylotheca top of dactylotheca body is equipped with an elastic band, elastic band end -to -end connection nail cover, the nail cover is the mushroom -shaped and makes with flexible material. The utility model discloses but the monolithic stationary and the bed body effectively avoid the dactylotheca to drop, and protecting effect and use comfort reinforcing are fit for the psychiatric department patient and wear the use."
1.3745704467353952,CN105748137A,"The invention discloses an auxiliary fracture setting device for breastbone fracture reduction. The auxiliary fracture setting device comprises a bed board clamping device, a lifting rod, a lifting rod adjusting bolt, a cross beam, an end face bearing, a pull rod displacement adjusting hand wheel, a pull rod, a shoulder press plate, a bone nail support and a bone nail. The lower end of the lifting rod is connected with the bed board clamping device, the upper end of the lifting rod is connected with the middle of the cross beam through the lifting rod adjusting bolt, the shoulder press plate is arranged at the front end of the cross beam, the upper face of the cross beam is rotationally connected with the middle of the pull rod through the end face bearing, the middle of the pull rod is connected with the pull rod displacement adjusting hand wheel through a gear, and the end of the pull rod is connected with the bone nail through the bone nail support. Compared with the prior art, the auxiliary fracture setting device is fixed to a surgical bed through the bed board clamping device, the cross beam is lifted or lowered through the lifting rod to press one shoulders of a patient, the bone nail is struck into fractured bone, and the fractured bone is then moved through the pull rod displacement adjusting handle wheel; besides, the position can be effectively maintained, a fracture setting steel sheet can be conveniently struck in, and the auxiliary fracture setting device is convenient to use and has application and popularization value."
0.4329004329004329,CN105686877A,"The invention relates to the field of medical apparatus, and discloses a supporting device for a catheter-based renal sympathetic denervation robot pusher. The supporting device is characterized by comprising transverse regulating mechanisms and a supporting assembly, wherein the supporting assembly comprises height regulating mechanisms, a longitudinal regulating mechanism, a turning mechanism and a slewing mechanism; two transverse regulating mechanisms and two height regulating mechanisms are arranged; the two transverse regulating mechanisms are arranged on two sides of a medical bed; each of the height regulating mechanisms is arranged on the corresponding transverse regulating mechanism; the longitudinal regulating mechanism spans the two height regulating mechanisms; the turning mechanism comprises a turning base, a long handle and a turning plate; the turning base is arranged on the longitudinal regulating mechanism; one end of the turning plate is hinged with the turning base and the other end is provided with a spherical chute; a spherical nail is arranged at the front end of the long handle; a turning regulating button is arranged at the rear end of the long handle; the long handle inserts on and is connected to the turning base in a threaded mode; the spherical nail is connected to the spherical chute; and the slewing mechanism is arranged on the turning plate."
1.3888888888888888,UA105654C2,"The present invention is directed to compositions and methods for stimulating the growth of nails and cuticles in a mammal, including humans. The compositions may be administered topically to the nail bed, nail matrix and cuticle in an amount effective to increase nail growth and thicken, strengthen and smooth the nail. The composition is also effective in strengthening and growing nails, including fingernails and toenails."
1.36986301369863,UA105653C2,"The present invention is directed to cyclosporine compositions and methods for stimulating the growth of nails and cuticles in a mammal, including humans. The compositions may be administered topically to the nail bed, nail matrix and cuticle in an amount effective to increase nail growth and thicken, strengthen and smooth the nail. The composition is also effective in strengthening and growing nails, including fingernails and toenails."
0.5102040816326531,CN205369243U,"The utility model relates to a take soil nail that prestretches of stiffening rib. Its characterized in that includes: soil nail, position casing, stiffening rib and directional spring, lie in the end part beyond the glide plane at soil nail, welding position sleeve pipe straggly inserts in position casing and strengthens the rib steel muscle, and its one end is processed into the tip form, and the other end has been bent with the location, is strengthening the directional spring of welding between rib steel muscle and the soil nail reinforcing bar. The utility model discloses not only be applicable to the foundation ditch or the side slope support on general stratum, there is extremely extensive engineering application on szyrt, weak soil, the thick miscellaneous bad stratum such as soil and sand gravel of banketing, expand by force of being applicable to in line in fields such as ground high slope, deep basal pit lateral wall, railway and highway tunnel, subway, pier, bridges and culverts, harbour, road bed, dykes and dams, mines."
0.5747126436781609,CN205369787U,"The utility model discloses a pollution -free simple and easy installing fastener, including smooth ball track, track fixing clip, basic unit's pendant main part and decorative board pendant main part are installed in the basal plate smooth ball track, install on the smooth ball track the track fixing clip, the basal plate is installed outward basic unit's pendant main part, install stationary hump in basic unit's pendant main part, install on the decorative board decorative board pendant main part, install pendant fixing device in the decorative board pendant main part. Beneficial effect lies in: installation cost is low, the fastener large -scale production, and produced expense is low, and the erecting bed does not have other auxiliary materials and can install yet, and safe firm, the scene do not use glue with straight nail, accord with the modern and to the requirement of health and environmental protection, do benefit to and use widely."
0.7246376811594203,UA87538U,"A method for correcting post-traumatic contracted deformity of the distal phalanges of the fingers provides for the partial resection of the distal part of the deformed nail plate and V-Y plastic reconstruction of the defect of the soft tissues of the palmary surface. Two thirds of the deformed nail plate is resected. The double homodigital and adipofascial flaps with antegrade blood flow is tailored and mobilized along the palmary surface of the injured finger. The combined complex is transposed onto the bone base of the rest of the distal phalange (homodigital flap - onto the palmary surface, adipofascial flaps - onto the back surface generating the fingernail bed). The adipofascial flaps are intrerconnected with interrupted sutures. Autodermoplasty of the reconstructed fingernail is provided and the aseptic bandage is applied."
