1.1235955056179776,US2017165499A1,"A method and device for treating an infection of the nail or nail bed and adjacent tissues through non-thermal means is described. The device illuminates an area with light in the near-infrared region of the electromagnetic spectrum. Preferably, light having wavelengths of from about 870 nm to about 930 nm will be used. Further, the device includes light emitting diodes that are capable of emitting ultraviolet light. These lights are intended to provide a sterile environment for a user using the device."
2.4390243902439024,US2017165249A1,"Methods and compositions for treating disorders of the nail and nail bed. Such compositions contain a vehicle in which all components of the composition are dissolved, suspended, dispersed, or emulsified, a non-volatile solvent, a wetting agent, and a pharmaceutically active ingredient that is soluble in the non-volatile solvent and/or a mixture of the vehicle and the non-volatile solvent, and which composition is effective in treating a disorder of the nail or nail bed."
1.8404907975460123,RU2618203C1,"FIELD: medicine.SUBSTANCE: ingrown part of the body, nail root are resected. Devitalization of matrix growth plate, contacting with remote part of the nail root of lateral and medial areas of nail bed proximal sulcus, inner surface of periungual wall and longitudinal segment of the nail bed, providing formation of the buffer zone between resected edge of the nail plate and periungual wall, is carried out. Devitalization is carried out using a radio wave electrode located in the angular area of the nail bed sulcus at an angle not exceeding 60° to the longitudinal axis of the nail phalanx, and at an angle to the electrode projection on the axial plane not exceeding 10°.EFFECT: method prevents damage to periungual wall by the edge of the nail plate, which eliminates the reason for ingrown nail recurrence, and also prevents the deformation of the growing nail plate towards the lateral periungual wall.9 dwg"
3.1578947368421053,WO2017039488A1,"The claimed method for performing ophthalmosurgical operations includes forming a recipient bed and implanting an autograft consisting of a portion of the patient's own nail plate, which is shaped to fit the recipient bed, and which is sterilized and then kept in a dry environment prior to implantation. The autograft is similar in chemical composition and physical characteristics to the tissues of the eye, is not accompanied by an immune system rejection reaction, and adapts to the shape of the recipient bed as a result of natural swelling."
0.3546099290780142,CN106420029A,"The invention discloses a radius nut intramedullary nail. A medullary fixation rod is a straight type solid rod, the penetrating end of the medullary fixation rod is prepared into a fixed head with a nut, and the other end of the medullary fixation rod is an inverted-cone fixed end. A fixed hole in which the intramedullary nail is embedded is formed in the inverted-cone fixed end, and the intramedullary nail is embedded in the fixed hole; the tail end of the inverted-cone fixed end is provided with a connection hole, and a hand shank is connected with the connection hole. According to the radius nut intramedullary nail, the fixed head, which is formed by the connection of external threads and internal threads in a screwing mode, is arranged on the rod wall of the penetrating end of the medullary fixation rod, and the straight-line type rod body of the fixed end of the medullary fixation rod changes from narrow to wide gradually and eventually is formed into a inverted-cone shape. The length of the straight type solid rod body of the medullary fixation rod is about 16-28cm, the length of the inverted-cone fixed end is about 5-10cm, and the widest diameter of the inverted cone is about 1.0-3.0mm. The radius nut intramedullary nail is fixed firmly, and thus has the advantages that disability rate of a patient is reduced, postoperative rehabilitation of the patient is strengthened, forearm rotation function is recovered, bedbound period is reduced, and complications of the patient are avoided due to staying in bed and the like."
2.9411764705882355,US2017049209A1,"A nail clip includes a base, a top, and a spring element. The base defines a bed, a first finger grip coupled to the bed, opposing slotted posts coupled to the base and extending therefrom where the bed meets the first finger grip, and a ramp disposed in the bed. The top defines a cap, a second finger grip coupled to the cap, and opposing support posts coupled to the cap and extending therefrom where the cap meets the second finger grip. Each support post includes a hinge pin extending therefrom for engagement with one of the base's slotted posts. The spring element is disposed between the base and the cap for biasing the first finger grip away from the second finger grip."
1.1811023622047243,CN205780258U,"The utility model provides an intensity is higher, more is suitable for horizontal installation, just can effectively prevent to cut with scissors chain pin and drop, avoids making the bed board collapse to a hinge structure for intelligent beddo of human body production injury because of the hinge drops. It includes two symmetrical structure's L type mount pad (2), and L type mount pad (2) is through installation component and electronic bed board (3) fixed connection, installation component includes vertical installation bolt (1) and pre -buried claw nail (4), be equipped with the anticreep claw hook on the pre -buried claw nail (4), pre -buried claw nail (4) is pre -installed on electronic bed board (3), and threaded connection is passed through with pre -buried claw nail (4) in vertical installation bolt (1), be equipped with the ear in band -pass hole on the L type mount pad (2), the ear of two L type mount pads (2) realizes rotatable coupling through horizontal construction bolt (5) and aluminum -plastic laminated tube (8), it has nylon cover (6) still to overlap on horizontal construction bolt (5), it has nylon cushion piece (7) to fill up between aluminum -plastic laminated tube (8) and the ear."
0.5319148936170213,CN205791413U,"The utility model discloses a novel railway slot cable support has stand structure, fastening structure, scrobicula groove and drainage structures, wherein, the stand structure has left stand, right stand, small hook and big hook, the fastening structure has recess, cross slot, swivel nut, location nail, bolt, fixed head and apron, the apron is fixed on the fixed plate through set screw, and the swivel nut of being convenient for like this, location nail, bolt and fixed head are settled in the cross slot, three small hook all fixes on left stand, and is more convenient when low tension cable and communication cable settle, support structural strength needs, material saving are moreover not only satisfied to the scrobicula groove, drainage structures comprises fillet and wash port, does benefit to the drainage like this, also does benefit to arrangements that can stabilize under the condition of slot bottom irregularity, is applicable to the cable support of use in railway roadbed or railway tunnel road bed."
0.37593984962406013,CN205776257U,"The utility model discloses an underground structure based on high pressure jet grouting pile, include to the domatic reinforced (rfd) soil nail wall, a plurality of bottom sideline along foundation pit slope of carrying on in foundation pit slope's upper portion by preceding bank protection stake of laying after to and the guan liang who lies in a plurality of bank protection stake upper portions, connect by the preceding high pressure jet grouting pile who lays after to through a plurality of between two adjacent bank protection stakes, stagnant water curtain of formation is connected with all high pressure jet grouting pile that lie in between two adjacent bank protection stakes to a plurality of bank protection stakes, foundation pit slope is earth filled layer, silt layer, boulder bed and sandstone layer from top to bottom respectively, and the sandstone layer uses high pressure jet grouting pile's top surface to be divided into upper portion sandstone layer and lower part sandstone layer as the boundary, and upper portion sandstone in situ is provided with one row of first water -drain mast, and upper portion sandstone in situ is provided with the multirow from top to bottom and reinforces the stock. The utility model has the advantages of simple structure and reasonable design and the construction is simple and convenient, excellent in use effect, can accomplish the process of strutting of sandstone layer foundation ditch portably, fast to strut effectually, the construction degree of difficulty is low."
0.4166666666666667,CN205776268U,"The utility model provides a highway's solid stop motion room greening structure in roadside, relates to side slope problem technical field, including highway road bed (1) and slope (2), slope (2) set up the one side in highway subgrade (1), still be equipped with the solid stop motion room greening structure in roadside on slope (2), the solid stop motion room greening structure in roadside includes geotechnological cloth (3), solid stop motion room module (4), a set of J type anchor nail (5), a set of reinforcement reinforcing bar (6) and is used for pipeline (7) of drainage, the adhesion of geotechnique's cloth (3) at slope (2) on the surface, gu stop motion room module (4) are closed by a set of partition plate group and are formed, form the groove that is used for loading soil between the baffle, the utility model discloses highway's solid stop motion room greening structure in roadside, every grid unit have high intensity, can realize rapid drainage, form the three -dimensional protective screen of a weight equiblibrium mass distribution again, can prevent effectively that displacement deformation, soil erosion and water loss, the slope body from sining."
1.3793103448275863,CN106224946A,"The invention discloses an anti-abrasion circulating fluidized bed boiler which comprises water cooled walls, a dense-phase zone, a transition zone and a dilute-phase zone; the surfaces of the water cooled walls are coated with anti-abrasion coatings; the water cooled walls are formed by connecting water cooled wall tubes and fins; clamping nails and anti-abrasion beams are arranged on the water cooled walls; the clamping nails are connected with the fins; the anti-abrasion beams are laid on the clamping nails, coat the clamping nails, and are abutted against the clamping nails and the water cooled wall tubes; and the anti-abrasion beams are further provided with guiding slopes. The anti-abrasion circulating fluidized bed boiler further comprises anti-abrasion plates arranged on the water cooled walls in the transition zone, and the anti-abrasion plates are connected with the fins through groove tubes. According to the anti-abrasion circulating fluidized bed boiler, the anti-abrasion beams and the anti-abrasion plates reduce a flow rate of a particle cluster of a near-wall zone at the periphery of a hearth in the anti-abrasion circulating fluidized bed boiler, and the guiding slopes in the anti-abrasion beams reduce particles of the near-wall zone at the periphery of the hearth. Therefore, the anti-abrasion beams and the anti-abrasion plates reduce the speed and concentration of a wall-adhering flow of the hearth significantly, and the abrasion to the water cooled wall tubes is reduced effectively. In addition, slideways of the anti-abrasion plates exert functions of guiding the particles to be far from the water cooled walls, to fall to the anti-abrasion beams, and then to fall down along the anti-abrasion beams."
4.4692737430167595,CN106165994A,"The present invention discloses an upper-bed and lower-desk type combination bed, which comprises a bed frame arranged on an upper bed, and a safe baffle assembly forming a matched connection with the bed frame, wherein one bed frame side close to a ladder frame is provided with a notch, the bed frame on both ends of the notch is respectively provided with a first groove portion and a second groove portion, the outer end of the second groove portion is provided with a first pin hole, the safe baffle assembly comprises a plate, one end of the plate is provided with a second pin hole, and the plate can be rotatably connected to the bed frame by inserting a pin nail in the first pin hole and the second pin hole. According to the present invention, the upper-bed and lower-desk type combination bed has characteristics of high safety factor, simple structure and easy operation, is suitable for popular use, and has strong market application prospects."
1.1952191235059761,CN205951146U,"The utility model discloses a mechanism of control die sinking order, inlay needle, panel, a board, B board including locking bed, screw, lock sleeve, grub screw, spring and pin, front mould, the front mould is inlayed the needle and is fixed on the panel, its characterized in that: the lock sleeve passes through the screw fixation on the B board. Place the spring in the hole of lock sleeve, the spring is restricted in the lock sleeve by the grub screw, and the spring front end is equipped with the pin, and the lock sleeve is opened at the fore -and -aft direction of pin and is kept away the dead slot, the seesaw of supply and marketing nail. The locking bed passes through the screw fixation on the A board, and the locking bed is opened in the place ahead of pin has positioning groove. Its advantage is: this mechanism this as metal material, can be high temperature resistant, but the wide application on high temperature and normal atmospheric temperature mould, the part is longe -lived. The mechanism is in the mould surface, and the dismouting is convenient with the maintenance, need not open the mould and can change and maintain the maintenance. The mechanism carries out control mold die sinking order through self mechanical motion, and stability is high."
2.6785714285714284,CN205954519U,"The utility model provides a wane obstructs formula road limit for height frame, by a foundation pile, a movable bed frame, a portable beam and two screens tenons are constituteed, the foundation pile nail is due to subaerial, the activity bed frame makes up on the foundation pile with the circle axle, the movable cross rod cover is inserted on the pipe of establishing on the activity bed frame, block the tenon card and arrange movable bed frame underframe rear end 's draw -in groove downside in, when the automobile body height surpasss the vehicle of conventional road within for the high 20cm of limit for height frame door opening and swarms into, the automobile body of vehicle superelevation can push up the pull -out height and drive activity bed frame leans forward and will locate the road speed reduction ladder type arch bar of movable rack front end and stick up portable beam, it moves ahead to bottle up the wheel, thereby can avoid taking place the car ruins, the serial road traffic accidents such as and consequently then sending out the road paralysis of putting up, the activity bed frame withdraws from the available hand in back and pulls the screens tenon and reset rushing the limit vehicle."
1.0204081632653061,CN205927827U,"The utility model discloses a set nail metal assembly jig is exempted from to the tray, including the operation platform who has the limit positioning area, parallel the broadside of limit positioning area is equipped with a bed board location strip frame, parallel the long limit of limit positioning area is equipped with longeron location strip frame. Top bed board location strip frame and longeron location strip frame are by forming with the integrative multiple modules of operation platform. The beneficial effects of the utility model are that: simple structure's tray adopts modularization processing technology, fuses the twice process and once only accomplishes, and the shaping is unified, pleasing to the eye, and batch production fast, has improved efficiency and precision. Adopt die positioning, realize fast assembly, reduced repeated measuring tape. The steel sheet is adopted to the bottom, makes pin fin bending naturally, reduces artifical dish nail, has improved production efficiency and product quality. Having solved middle baffle simultaneously and having needed the manual ailing of supporting, dangerous high problem improves operational safety."
3.0303030303030303,CN205923511U,"The utility model discloses a hidden lifting bed system of wall, it includes a pair of stand of vertical setting in the shingle nail, both ends are fixed through top beam and cross member respectively about the stand, the stand back is provided with the slide rail, be connected with the adjustable shelf through the sliding sleeve on the slide rail, be provided with the swivel nut in the middle of the adjustable shelf, the swivel nut screw cup joints on the screw rod, the screw rod sets up in the middle of the coexistence post, the screw rod upper end is fixed through bearing and top beam, and the lower extreme is through soft coupling joint motor, the adjustable shelf level is fixed with the bed surface fixed plate, the bed surface fixed plate is located the shingle nail outside. It can make the bed to realize an automatic oscilaltion, hides the bed to the roof in the time need not using bed, improves the utilization ratio of the interior space, the stability simple to use of while simple to operate."
0.4149377593360996,CN205935378U,"The utility model provides a novel composite thermal insulating brick, including fire prevention composite insulation board and the compound building block of self preservation temperature concrete, be equipped with a bed boundary agent between the compound building block of fire prevention composite insulation board and self preservation temperature concrete, the inside rectangular cavity that is equipped with of the compound building block of thermal insulation concrete, parallel and the equidistance of each cavity, fire prevention composite insulation board dew is equipped with a plurality of heat preservation nail in the one side in the outside, heat preservation nail's pointed end is passed fire prevention composite insulation board and is inserted in the compound building block of self preservation temperature concrete, and heat preservation nail is located between the compound building block of self preservation temperature concrete two inside adjacent cavitys, heat preservation nail is last to be equipped with a plurality of heat preservation nail barbs, a plurality of heat preservation nail barbs pierce fire prevention composite insulation board respectively and the compound building block of self preservation temperature concrete is fixed. The utility model discloses make the user become more convenient to insulation block's use, solved the unstable problem of focus of insulating brick effectively, and had higher bearing capacity, solved the blocked up problem of wall body, have better fire prevention function."
0.27100271002710025,AU2016102128A4,"Abstract of The Nail Snail Innovation Patent Application - Christie & Christie Abstract It is a three in one (3-in-1) nail care tool. It has a trimming blade with a safety guard, a nail file and an under nail cleaner. 1.The stainless steel trimming blade, or the 'head' of the snail is a v shaped, metal blade with folded up 'eyes' that act as a safety guard so to protect the other fingers / toes. The blade make sit very easy to see the exact width of nail being trimmed and can easily follow the natural curve of the nail bed. 2. The 'neck' has the logo and Nail Snail product name engraved into the under side for product and branding recognition. 3. The 'shell' is rounded plastic and rubber. It has a flatter part near the neck and it taller at the back. This ergonomic design allows maneuverability, safe grip and handling. The rubber makes it easy to grip. It fits well in the hand of the adult. 4. The nail file at the base assists in trimming rough or sharp nail edges. 5. The under nail cleaner can remove dirt and grime from underneath fingernails and toenails and also lift out ingrown nails to then cut them. 6. It is not a choking hazard due to the length of The Nail Snail. 7. The Nail Snail is dishwasher safe. It is designed to be cleaned on the top shelf of a dishwasher or in warm soapy water. Dimensions Length: 63.24 mm, Height: 23.56 mm, Width: 15.56 mm, Weight: 7.5 grams Manufacturing Process The metal is folded and cut, surface is ground down to form cutting edge. Metal trimmer is ultrasonically welded to plastic shell. Plastic injected molded shell frame with rubber over molding. Acid etched nail file texture. Logo and Nail Snail engraved on underside of metal 'neck'. FIGURE 4 -Side View Al.A 1 k FIGURE 6 - Bottom & eView '"
4.166666666666667,CN106341952A,"The invention provides a preparation method of a nail bed used for ceramic PCB processing. The nail bed prepared by the method can be suitable for technologies including screen printing of different patterns of ceramic PCBs, the problems that a present nail bed tends to hurt the PCBs and is low in adaptation but high in cost and management difficulty are solved, and the working efficiency is improved."
2.985074626865672,CN205903079U,"The utility model provides a processing technology simplifies more, adds to need not to use glue man -hour, and machining efficiency is higher, environmental protection more during the use, and life is longer, and the travelling comfort is better, adopt bed board of intelligent beddo of PU foaming technique that multiple styles is better. Its characterized in that: it includes bed board (6), bed board (6) go up the pre -buried a plurality of claws nails (7) that have, the surface of bed board (6) still have PU foaming layer (8) through mould hot pressing parcel, PU foaming layer (8) simultaneously with including claw nail (7) the parcel."
1.838235294117647,TW200600302A,"This invention relates to a trimming and splicing apparatus with adjustable angles, including: a machine bed, a sawing mechanism, a nailing mechanism, a sawing angle adjustment device and a nailing angle adjustment device. The sawing mechanism and nailing mechanism are both provided in the machine bed and located at opposing sides within the machine bed. The sawing angle adjustment device is mounted on the machine bed, for allowing the sawing mechanism to perform sawing operation. The sawing angle adjustment device includes a protractor and a stopping plate pivoted to the protractor. The protractor is provided with plural angle setting holes, into which the blocking plate may be positioned to assume different angular orientation. The frame strips placed in front of the blocking plate may be trimmed by the sawing mechanism into the desired angles. The nailing angle adjustment device is provided on the machine bed, for allowing the nailing mechanism to perform splicing operation. The nailing angle adjustment device includes a bottom plate, a protractor plate, and a clamping plate. The protractor plate and clamping plate are both pivoted to the bottom plate. The protractor plate is provided with plural angle setting holes, into which the clamping plate may be positioned to assume different angular orientation. The clamping plate and the protractor plate form an included angle there between. Two separate frame strips may be placed between the protractor plate and the clamping plate. The nailing mechanism then performs the splicing operation to obtain the desired included angle."
1.492537313432836,CN205894360U,"The utility model discloses a concrete wall's inside and outside bed of mortar rigid coupling board, including the base plate, back of the substrate is equipped with the nail that is used for inserting the extruded sheet, and positive face mould board support column of base plate and reinforcing bar are perforated, the base plate lower extreme is equipped with the recess that cup joints lower block of rigid coupling board. Compared with the prior art, the utility model the advantage be: the utility model discloses the bed of mortar that can make inside and outside difference links together with fastening, has strengthened an organic whole nature and the intensity of wall body greatly, increase of service life, excellent in use effect."
1.4492753623188406,AU2016277570A1,"Abstract Methods and compositions for treating disorders of the nail and nail bed. Such compositions do not form a film upon application to the surface of the nail and contain a vehicle in which all components of the composition are dissolved, suspended, dispersed, or emulsified, a non-volatile solvent, a wetting agent, and a pharmaceutically active ingredient that is soluble in the non-volatile solvent and/or a mixture of the vehicle and the non-volatile solvent, and which composition is effective in treating a disorder of the nail or nail bed. (Figure 1) 12.0% g 10.0% 'C0 * o 8.0% cDo .-- 6.0% mro. o< 4.0% 2.0% 0.0% 2313-078 2313-080 2313-082 2313-107 Figure 1 SUBSTITUTE SHEET (RULE 26)"
