0.8968609865470852,CN105736833A,"The invention discloses a cable trough support of a railroad bed. The cable trough support is manufactured integrally and provided with supporting columns, a left large hook, a right large hook, a left groove, a middle groove, a right groove, locating holes and locating nails. The left large hook is close to the inner side of the upper portion of the left side wall of a cable trough. The right large hook is close to the inner side of the upper portion of a partition wall of the cable trough. The left groove, the middle groove and the right groove are formed in the bottom in the cable trough support of the railroad bed. Thus, the requirement that a railroad power supply through line is arranged on the upper portion and a low-voltage cable or a control cable is arranged on the lower portion can be met; and when guided out of the cable trough, the low-voltage cable or the control cable does not intersect with the railroad power supply through line, and therefore other cables cannot be influenced or moved during cable laying and maintenance and replacement of one cable, and the cable trough support is suitable for laying of all trough cables."
1.1494252873563218,CN105728792A,"The invention discloses a lathe bed two-end long distance hole drilling clamp, and belongs to the machine tool clamp design technical field; the lathe bed two-end long distance hole drilling clamp comprises a drill plate, a fulcrum bearing, support nails, a positioning pin, a positioning seat, a positioning plate, a guide rod, a positioning block, quick-change drill sleeves, a dovetail locating piece, a pull rod, and a dovetail briquetting; the fulcrum bearing is fixed on the right lower side of the front surface of the drill plate; the support nails are arranged on four corners of the drill plate; one end of the locating piece is firstly employed for positioning, then the positioning pin and positioning seat are plugged for contacting location; a screw rod seat mount hole on the right end of a processing part is positioned by the left positioning plate and the positioning seat making contact; a motor seat mount hole on the left end of the processing part is positioned as well; the top end of the rear surface of the drill plate is fixedly provided with the dovetail locating piece; the clamp and the workpiece are mainly positioned by a dovetail guide rail and the positioning block; the plurality of quick-change drill sleeves are arranged on proper positions on the drill plate; the lathe bed two-end long distance hole drilling clamp is high in drilling precision, and low in clamping difficulty."
2.985074626865672,CN105704939A,"The invention discloses an all-purposed bed of nails. The bed of nails comprises a baseboard of the bed of nails, the baseboard is provided with positioning holes, first slots and second slots, the positioning holes are formed on the left upper corner of the baseboard, and composed of four equidistantly arranged longitudinal rows in parallel; the first slots are formed on the left lower corner of the baseboard, and composed of four equidistantly arranged longitudinal slots in parallel; the second slots are formed on the right upper corner of the baseboard and composed of four parallel horizontal slots; the baseboard is provided with a rectangular or square tack hole dense area, the tack hole dense area is provided with a plurality of tack holes of bed of nails, the tack holes are arranged in the tack hole dense area. Through the adoption of the bed of nails disclosed by the invention, the cost is saved, the storage space of the baseboard of the bed of nails is reduced, the use is convenient, the management difficulty is lowered, and the working efficiency is improved."
0.7731958762886598,CN205321900U,"The utility model provides a comfortable crib of accompanying, relates to mother and child care and infant care professional domain, aims at solving mother and goes on a journey cervical vertebra, thoracic vertebrae and lumbar vertebrae that the in -process scientifically protected baby, infant and use and let the baby is comfortable, mother the is laborsaving crib or the technical problem of baby's back of the body frame carrying the baby of age for 0 to 6 months, comfortable crib of accompanying is by the rectangular bodily form take shelter from the wind cloth (1), thick rectangle wood frame (2), stainless steel rectangle silk screen (3), thin rectangle wood frame (4), wood frame sack (5), the baby rests the head on (6), area (7) are carried on the arm to the crib shoulder, four pyramid safety belt (8), left side woven belt link (9), baby's bed board lap belt (10), right side woven belt link (11), baby's bed board below safety belt (12), rectangular bodily form cloth top safety belt (13) and rectangular bodily form cloth below safety belt (14) the component of taking shelter from the wind of taking shelter from the wind, favor rectangle wood frame (2) and thin rectangle wood frame (4) and carry stainless steel rectangle silk screen (3) alignment, with the frame of two fixed wooden frames of iron nail, in pack into wooden frame sack (5), with the opening of fibre seam wooden frame sack (5), make baby's bed board, put on cloth (1) is taken shelter from the wind to the rectangular bodily form, fasten seat belts, use the crib shoulder to carry area (7) on the arm, carry on the arm and go on a journey at mother's shoulder -mounted, warm in winter and cool in summer, the baby is comfortable, and mother is laborsaving, and the walking is convenient safely."
0.7518796992481203,CN205307194U,"The utility model provides a patient's about band of accompanying and attending to includes frenulum (1), a sponge cushion (2) and two pieces of magnetism nails (3) of a cotton, one metal skin belt buckle (11) are being fixed to the one end of frenulum, and the other end of frenulum is distributing the several along length direction and is buckleing hole (12), the sponge cushion is buckled and is circularized, and is fixed with magnetism nail (3) after the looks coincide of both ends, has a cotton to buckle (21) on the surface of sponge cushion, and the cotton was buckled on the sponge cushion was passed to the one end of frenulum, again with the metal skin belt buckle for the other end of frenulum with buckle the hole reciprocal anchorage and be in the same place. With sponge cushion parcel in patient's wrist, live with the magnetism nail fixing, pass a fence with the frenulum, the cover is in family members' wrist, the length of adjustment frenulum makes it neither influence the home range that patient and family members' rest can limit the patient again. Family members' perception in time when the patient leaves the bed without authorization or had by a wide margin activity, tractive can prevent that the patient from leaving or weighing down the emergence of bad incidents such as bed by oneself at night."
1.4423076923076923,CN205314421U,"The utility model discloses a paint wall external corner angle bead strip, including angle bead strip body, wherein, angle bead strip body is PVC plastics angle bead strip body, the section bar cross -section contained angle of PVC plastics angle bead strip body is greater than 90 degrees, the fretwork is provided with the nail hole on the PVC plastics angle bead strip body, edge's coating of PVC plastics angle bead strip body has the putty to cover the fixed bed, the edge of PVC plastics angle bead strip body is formed with miniature honeycomb or pitted skin structure, the putty covers and is equipped with the binder layer between fixed bed and the PVC plastics angle bead strip body surface. The utility model provides a paint wall external corner angle bead strip adopts PVC plastics angle bead strip body, and nail hole and edge's deposited putty through surperficial fretwork cover the fixed bed, improve the mechanical properties behind the angle bead, not only make paint wall external corner more straight and upright, but also reinforcing external corner toughness reduce the large tracts of land coating damage that the upon impact brought."
0.819672131147541,US2016175612A1,"A method for treating a fungal infection in an infected nail is disclosed. An embodiment includes placing an optical delivery system designed to deliver a laser beam with light having strongly water-absorbed wavelengths to the infected nail. The diseased nail is irradiated with the laser beam, and the fluence and a duration of the laser irradiation received by the nail are adjusted such that by laser energy absorption in a surface portion of the nail a superficial heating of the nail and heat diffusion from said heated surface portion into the infected nail bed are achieved. The bottom of the nail plate in this embodiment is heated to a treatment temperature needed to inactivate the infecting organism."
1.4492753623188406,CN205250360U,"The utility model discloses a male sex's physiology maintenance pants, including the preceding width of cloth, the preceding width of cloth that inclines, back panel, elasticity limit and the shelves end, the preceding width of cloth, the preceding width of cloth of side, back panel, elasticity limit are sewed up the trousers that form and are personally experienced sth. Part of the body, the preceding width of cloth sew up and form by precoat, nail magnetic particle precoat, the energy seal point surface fabric bed of material, be equipped with magnetic particle on the nail magnetic particle precoat, be equipped with biological magnetic particle on the energy seal point surface fabric bed of material, biological magnetic particle includes the casing, be equipped with in the casing release anion the material layer, the radiation far -ultraviolet the material layer, take the magnetic material layer, perhaps be equipped with the release anion in the casing, radiate the far -ultraviolet, have magnetic mixed material layer, the back panel on the low back sew up and form by precoat, nail magnetic particle precoat, the energy seal point surface fabric bed of material, be equipped with magnetic particle on the nail magnetic particle precoat, be equipped with biological magnetic particle on the energy seal point surface fabric bed of material. The utility model relates to a male sex's physiology maintenance pants can permanent use, and can long -term effective, performance anion, far infrared and magnet therapy function effect."
0.7692307692307693,CN205237820U,"The utility model provides a grind clip nailing machine bed, including upright drill and angle mill, the lathe is still including the anterior angle mill support frame of fixed angle mill front end and the relief angle mill support frame of fixed angle mill rear end, the upright drill level is placed, and the axis of upright drill drill bit is on a parallel with ground and crossing with angle mill friction disc. The beneficial effects of the utility model are that the efficiency of clip nail grinding be can effectually improve, the oblique angle of clip nail and the diameter of point portion have been guaranteed above all to guarantee the same rhythm of the heart of same batch's clip nail."
0.5102040816326531,CN205224299U,"The utility model relates to an outer wall thickness type insulation construction, this structure includes: the structure purlin on the main structure body sets firmly, prop up to establish and be fixed in first heat preservation on the structure purlin, paste and locate the second heat preservation of the link of structure purlin, the second heat preservation with the adjacent setting of first heat preservation, and install in the shingle nail of second heat preservation lateral surface, the shingle nail with press from both sides between the installation end of structure purlin and establish the second heat preservation will through first connecting piece the shingle nail with the second heat preservation with the fastening is connected to the link of structure purlin. The utility model discloses thoroughly solved the problem that heat preservation thickness caused wall panel surface meteorism to warp, need not consider the building thickness problem that the insulation layer thickness brought during the construction completely, formed the air bed between two -layer heat preservation, the gas tightness and the energy -conserving effect of the side fascia system that has strengthened forming."
1.8433179723502304,CN205223770U,"The utility model relates to a crowded close stake of rubble adds muscle roadbed structure, belong to road design technical field, which has the advantages of simple structure, and reasonable design, convenient construction, effectively improve foundation soil intensity, improve the crowded close stake of rubble adds muscle roadbed structure of ground basis bearing capacity, the technical scheme who adopts sets up above consolidating the ground for adding the muscle road bed, consolidate the ground mainly by the crowded close stake of rubble, soil and blotter constitute between the stake, the crowded close stake plane of rubble is triangular distribution, the crowded close pile bolck of rubble sets up the blotter, it has soil between the stake to fill between the crowded close stake of rubble, it is provided with the shingle nail to add muscle road bed both sides, the shingle nail is installed on the shingle nail basis, be provided with the rib steel muscle along high layering in adding the muscle road bed, there are the both ends of rib steel muscle to fix on the shingle nail respectively, the utility model discloses the height that extensively the is used for wet subgrade road bed of filling."
0.5494505494505495,CN205165534U,"The utility model discloses a novel disconnected steel sheet nailing machine bed mould of production, including going out the nail steel shoe, going out nail concave groove holes, roating seat interface and mould body, the mould body is cylindrically, even cloth has a plurality of sector gear teeth on the mould body, evenly be equipped with disconnected steel sheet nail cell body around the mould body, mould body upside one end is equipped with out the nail steel shoe and goes out nail concave groove holes, it is located to go out the nail steel shoe go out on the nail concave groove holes, mould body bottom is equipped with the roating seat interface. The utility model discloses become cylindrical with the global design of mould, the mould can the counter -clockwise turning, simultaneously with mould and the ingenious combination of punch press, has realized the incessant operation of steel sheet nail preparation, has saved simultaneously and has placed the space, has practiced thrift manufacturing cost."
3.8461538461538463,CN205143145U,"The utility model discloses a pet bed, this pet bed are applicable to pet cat and small -size dog class, and this pet bed's main part is one yuan of arc -shaped bed body, and bed body below is equipped with the weight that L shape support comes support bed body and pet, is equipped with the through -hole on the support, and wall nail will for the through -hole for user's accessible the utility model discloses pet bed fixes on the wall, the top of the bed body is equipped with the elastic mattress who pastes the adhesion through the magic, can prevent that the pet from dragging the mattress to other places, the one end of the bed body is equipped with the hollow rubber ball of connecting through the elastic rod, be equipped with the round hole on the rubber ball, when hello food inclusive AND pet is played, the user can put into the hollow rubber ball with proper amount pet food, the pet is at the in -process of playing, along with the partial food of rocking of rubber ball is thrown away through the round hole, not only play the effect of food of feeding, also help the pet to acquire fast the utility model discloses the custom of the last rest of pet bed, very convenient, its beneficial effect is that the design is simple, reliably durable, the practicality is great."
4.972375690607735,CN205143144U,"The utility model discloses a pet bed, this pet bed's main part is one yuan of arc -shaped bed body, and bed body below is equipped with the weight that L shape support comes support bed body and pet, is equipped with the through -hole on the support, and wall nail will for the through -hole for user's accessible the utility model discloses pet bed fixes on the wall, and the top of the bed body is equipped with the elastic mattress who pastes the adhesion through the magic, can prevent that the pet from dragging the mattress to other places, and the one end of the bed body is equipped with circular recess, and the user can be put pet food in this recess, lures pet feed on the bed body, helps the quick custom of pet to have a rest on this body, and very convenient, its beneficial effect is that the design is simple, and reliably durable, the practicality is great."
5.181347150259067,CN205143143U,"The utility model discloses a pet bed, this pet bed are applicable to pet cat and small -size dog class, and this pet bed's main part is one yuan of arc -shaped bed body, and bed body below is equipped with the weight that L shape support comes support bed body and pet, is equipped with the through -hole on the support, and wall nail will for the through -hole for user's accessible the utility model discloses pet bed fixes on the wall, and the top of the bed body is equipped with the elastic mattress who pastes the adhesion through the magic, can prevent that the pet from dragging the mattress to other places, and the inside of the bed body is equipped with the heating member, and when temperature was lower, the user can be connected power plug when the pet rest with the power, makes the heating member circular telegram warm whole bed body that generates heat, and very convenient, its beneficial effect designs simply, and reliably durable, the practicality is great."
1.1450381679389312,CN105476682A,"The invention discloses a nail groove device of a prepuce cutter. The nail groove device comprises a nail groove top window, a nail groove bottom bed, nail groove inverted foot seats, nail groove side walls and a nail groove cavity, the nail groove cavity is provided with a space capable of containing a suturing nail, and the nail groove top window is positioned at the top of the nail groove cavity, so that convenience is brought to nail feet of the suturing nail to penetrate two ends of the nail groove top window; the nail groove inverted foot seats are positioned at two ends of the nail groove cavity, each nail groove inverted foot seat is of an arc-shaped structure, the nail groove bottom bed is positioned at the bottom of a nail groove and connected with the nail groove inverted foot seats at the two ends, and the nail groove side walls are arranged on two sides of the nail groove bottom bed respectively. The suturing nail after being formed is in the shape of a hairpin, and the nail feet after being formed are roughly parallel to a nail bridge to clamp prepuce inner-outer plate tissue to achieve the objective of closing tissue blood vessels to stop bleeding and closing inner-outer plate incisions; the nail feet do not reversely pierce into the tissue, so that the nail feet can be easily poked and extracted from a puncture wound track of the tissue after operation."
3.7037037037037037,RU2578086C1,"FIELD: medicine; ophthalmology.SUBSTANCE: method includes detecting bed and implantation in it of at least one graft. As material for producing graft fragment nail plate patient is simulated by shape of input of bed, and after sterilisation before implantation of graft is kept in dry atmosphere.EFFECT: method provides transplant adaptation to shape of input of bed from natural expansion and use of autograft, close in its chemical composition and physical properties to eye tissues."
0.9569377990430622,CN205106393U,"The utility model discloses a physiology of female reproductive maintains pants, including preceding, the incline preceding width of cloth, back panel, elasticity lace, the preceding width of cloth, the preceding width of cloth of side, back panel, elasticity lace are sewed up the trousers that form and are personally experienced sth. Part of the body, the preceding width of cloth sew up and form by precoat, nail magnetic particle precoat, the energy seal point surface fabric bed of material, be equipped with magnetic particle on the nail magnetic particle precoat, be equipped with biological magnetic particle on the energy seal point surface fabric bed of material, biological magnetic particle includes the casing, be equipped with in the casing release anion the material layer, the radiation far -ultraviolet the material layer, take the magnetic material layer, perhaps be equipped with the release anion in the casing, radiate the far -ultraviolet, have magnetic mixed material layer. The utility model relates to a physiology of female reproductive maintains pants can permanent use, and can long -term effective, performance anion, far infrared and magnet therapy function effect."
1.694915254237288,US2016081898A1,"The present invention is directed to compositions and methods for enhancing the health of nails and cuticles in a mammal, including humans. The compositions may be administered topically to the nail bed, nail matrix and cuticle in an amount effective to enhance nail health. The composition is also effective in strengthening and growing nails."
4.201680672268908,CN205088691U,"Slope height piece of smooth land structure of filling of soaking to effectively improve slope the soak stability and long -term durability of high embankment, and improve its resistance to settling and reduce the hydrodynamic influence of flood fluctuation. It includes: soil nail consolidates the confining bed, sets up in the basement rock mass, the compound foundation stabilization body sets up in the soft foundation soil body in the high fill toe outside, the lower part road bed fills the body, sets up and fills below the flood level at the height, the body is filled in the road bed transition, sets up to fill body top at the lower part road bed, the upper portion road bed fills the body, sets up to fill body top in the road bed transition, shallow layer geogrid, middle level geogrid and deep geogrid, the interval is laid and is filled among the body fills physically with the upper portion road bed at the lower part road bed, the side slope platform, the hierarchical setting on the side slope is filled to the height, lower part side slope inoxidizing coating sets up and fills body slope surface at the lower part road bed, upper portion side slope inoxidizing coating sets up and fills body slope surface at the upper portion road bed."
0.4132231404958678,CN205086133U,"The utility model discloses a plywood raw materials rotary -cut equipment, including quick -witted base, log mill skin platform, revolve cutting table and the veneer transports the platform, the top of machine base is installed the log in proper order from a left side to the right side and is ground the skin platform, it transports the platform to revolve cutting table and veneer, this plywood raw materials rotary -cut equipment grinds the skin platform by the log, it transports three big main parts of platform constitution to revolve cutting table and veneer, wherein the log grinds effective improvement work efficiency that sets up of skin platform, rotary cutter group has also been protected simultaneously, and be equipped with the rotary -cut mount soon on the cutting table, and the rotary -cut mount has from left to right set gradually and has stung the nail, the rotation axis with hold the axle bed, this sets up can the fixed rotary -cut log of interlock, and rotary cutter group is unchangeable when the rotary -cut, the rotatory adjustment rotary -cut log of rotation axis on the rotary -cut mount, thereby guarantee that the veneer thickness of rotary -cut play is even and unanimous, the utility model discloses the practicality of equipment is strong, and work efficiency is high, is fit for using widely."
1.3793103448275863,CN105397255A,"The invention discloses a plasma water bed cutting platform assembly. The plasma water bed cutting platform assembly comprises a water tank, a supporting platform, a water-stop sheet and a dust hopper, wherein the supporting platform is slantwise arranged above the water tank along the length direction of the supporting platform; the water-stop sheet is arranged between the water tank and the supporting platform; one end of the water-stop sheet communicates with the dust hopper; a gap exists between the dust hopper and the side wall of the water tank; the dust hopper is arranged between the supporting platform and the water tank and is located at the slantwise low end of the supporting platform; the supporting platform comprises a frame; a plurality of installing locations are uniformly arranged on the frame; a grid plate is detachably arranged at each installing location; a plurality of supporting nails are uniformly distributed on each grid plate along the length direction of the supporting platform; and the lengths of the supporting nails increase sequentially from the high end of the supporting platform to the low end of the supporting platform, so that a horizontal supporting surface is formed at one ends, being far away from the grid plates, of the plurality of supporting nails. The plasma water bed cutting platform assembly has the beneficial effects that the plasma water bed cutting platform assembly is simple in structure, can quickly discharge slag, has low pollution and can be used permanently, the slag is less likely to adhere to the surface of a platform, and cutting platform materials do not need to be changed."
